{
  "schemaVersion": 1,
  "updated": "2026-07-07",
  "featureCatalog": {
    "bench": [
      {
        "id": "browser_webgpu",
        "description": "Runs inference on WebGPU in browser."
      },
      {
        "id": "node_webgpu",
        "description": "Runs inference on WebGPU directly in Node runtime."
      },
      {
        "id": "bun_webgpu",
        "description": "Runs inference on WebGPU in Bun runtime."
      },
      {
        "id": "deno_webgpu",
        "description": "Runs inference on WebGPU in Deno runtime."
      },
      {
        "id": "headless_browser_harness",
        "description": "Has a maintained headless browser benchmark harness in this repo."
      },
      {
        "id": "standardized_workloads",
        "description": "Maps benchmark runs to shared workload IDs."
      },
      {
        "id": "cache_mode_control",
        "description": "Can force warm/cold cache behavior for repeated benchmark runs."
      },
      {
        "id": "decodeTokensPerSec",
        "description": "Reports decode throughput metric."
      },
      {
        "id": "prefillTokensPerSec",
        "description": "Reports prefill throughput metric."
      },
      {
        "id": "promptTokensPerSecToFirstToken",
        "description": "Reports prompt throughput normalized to first token."
      },
      {
        "id": "firstTokenMs",
        "description": "Reports time-to-first-token metric."
      },
      {
        "id": "modelLoadMs",
        "description": "Reports model load latency metric."
      },
      {
        "id": "firstResponseMs",
        "description": "Reports model-load plus first-token latency."
      },
      {
        "id": "prefillMs",
        "description": "Reports prefill wall-clock latency."
      },
      {
        "id": "decodeMs",
        "description": "Reports decode-only wall-clock latency."
      },
      {
        "id": "totalRunMs",
        "description": "Reports total run wall-clock latency."
      },
      {
        "id": "decodeMsPerTokenP50",
        "description": "Reports 50th percentile decode token latency."
      },
      {
        "id": "decodeMsPerTokenP95",
        "description": "Reports 95th percentile decode token latency."
      },
      {
        "id": "decodeMsPerTokenP99",
        "description": "Reports 99th percentile decode token latency."
      },
      {
        "id": "js_heap_memory_metrics",
        "description": "Reports JS heap memory metrics."
      },
      {
        "id": "gpu_memory_metrics",
        "description": "Reports GPU memory metrics."
      }
    ],
    "profile": [
      {
        "id": "kernel_level_gpu_timing",
        "description": "Provides kernel-level GPU timing breakdown."
      },
      {
        "id": "operator_level_timing",
        "description": "Provides model operator-level timing breakdown."
      },
      {
        "id": "top_ops_summary",
        "description": "Provides sorted top-op summary in benchmark output."
      },
      {
        "id": "per_decode_step_breakdown",
        "description": "Provides per-decode-step profiling breakdown."
      },
      {
        "id": "kernel_selection_trace",
        "description": "Provides selected kernel path/variant trace data."
      },
      {
        "id": "phase_memory_breakdown",
        "description": "Provides per-phase memory telemetry."
      },
      {
        "id": "cache_events",
        "description": "Provides cache hit/miss behavior telemetry."
      },
      {
        "id": "replayable_trace_artifact",
        "description": "Produces replayable trace artifact suitable for deterministic replay."
      }
    ],
    "format": [
      {
        "id": "rdrr_runtime",
        "description": "Loads and runs inference from RDRR format artifacts."
      },
      {
        "id": "onnx_runtime",
        "description": "Loads and runs inference from ONNX format artifacts via ORT."
      },
      {
        "id": "safetensors_runtime",
        "description": "Loads and runs inference from SafeTensors format directly at runtime."
      },
      {
        "id": "format_matrix_compare",
        "description": "Can benchmark same model across multiple formats for format-overhead isolation."
      }
    ]
  },
  "targets": [
    {
      "id": "doppler",
      "name": "Doppler",
      "bench": {
        "features": {
          "browser_webgpu": "supported",
          "node_webgpu": "supported",
          "bun_webgpu": "unsupported",
          "deno_webgpu": "unsupported",
          "headless_browser_harness": "supported",
          "standardized_workloads": "supported",
          "cache_mode_control": "supported",
          "decodeTokensPerSec": "supported",
          "prefillTokensPerSec": "supported",
          "promptTokensPerSecToFirstToken": "supported",
          "firstTokenMs": "supported",
          "firstResponseMs": "supported",
          "modelLoadMs": "supported",
          "prefillMs": "supported",
          "decodeMs": "supported",
          "totalRunMs": "supported",
          "decodeMsPerTokenP50": "supported",
          "decodeMsPerTokenP95": "supported",
          "decodeMsPerTokenP99": "supported",
          "js_heap_memory_metrics": "supported",
          "gpu_memory_metrics": "supported"
        }
      },
      "profile": {
        "features": {
          "kernel_level_gpu_timing": "supported",
          "operator_level_timing": "supported",
          "top_ops_summary": "supported",
          "per_decode_step_breakdown": "supported",
          "kernel_selection_trace": "supported",
          "phase_memory_breakdown": "supported",
          "cache_events": "supported",
          "replayable_trace_artifact": "unsupported"
        }
      },
      "format": {
        "features": {
          "rdrr_runtime": "supported",
          "onnx_runtime": "unsupported",
          "safetensors_runtime": "supported",
          "format_matrix_compare": "supported"
        }
      },
      "evidence": [
        "src/gpu/command-recorder.js",
        "src/inference/pipelines/text/generator-steps.js",
        "src/tooling/source-runtime-bundle.js",
        "src/tooling/node-source-runtime.js",
        "docs/operations.md",
        "tools/compare-engines.js",
        "tools/qualify-installed-reranker-browser.js",
        "benchmarks/vendors/harnesses/doppler-rerank-reference.json"
      ]
    },
    {
      "id": "doppler-simulatte",
      "name": "Doppler (webgpu)",
      "bench": {
        "features": {
          "browser_webgpu": "unsupported",
          "node_webgpu": "supported",
          "bun_webgpu": "unsupported",
          "deno_webgpu": "unsupported",
          "headless_browser_harness": "unsupported",
          "standardized_workloads": "supported",
          "cache_mode_control": "unsupported",
          "decodeTokensPerSec": "supported",
          "prefillTokensPerSec": "supported",
          "promptTokensPerSecToFirstToken": "supported",
          "firstTokenMs": "supported",
          "firstResponseMs": "supported",
          "modelLoadMs": "supported",
          "prefillMs": "supported",
          "decodeMs": "supported",
          "totalRunMs": "supported",
          "decodeMsPerTokenP50": "supported",
          "decodeMsPerTokenP95": "supported",
          "decodeMsPerTokenP99": "supported",
          "js_heap_memory_metrics": "supported",
          "gpu_memory_metrics": "supported"
        }
      },
      "profile": {
        "features": {
          "kernel_level_gpu_timing": "supported",
          "operator_level_timing": "supported",
          "top_ops_summary": "supported",
          "per_decode_step_breakdown": "supported",
          "kernel_selection_trace": "supported",
          "phase_memory_breakdown": "supported",
          "cache_events": "supported",
          "replayable_trace_artifact": "unsupported"
        }
      },
      "evidence": [
        "benchmarks/vendors/harnesses/doppler-simulatte.json"
      ]
    },
    {
      "id": "doppler-webgpu-npm",
      "name": "Doppler (webgpu npm)",
      "bench": {
        "features": {
          "browser_webgpu": "unsupported",
          "node_webgpu": "supported",
          "bun_webgpu": "unsupported",
          "deno_webgpu": "unsupported",
          "headless_browser_harness": "unsupported",
          "standardized_workloads": "supported",
          "cache_mode_control": "unsupported",
          "decodeTokensPerSec": "supported",
          "prefillTokensPerSec": "supported",
          "promptTokensPerSecToFirstToken": "supported",
          "firstTokenMs": "supported",
          "firstResponseMs": "supported",
          "modelLoadMs": "supported",
          "prefillMs": "supported",
          "decodeMs": "supported",
          "totalRunMs": "supported",
          "decodeMsPerTokenP50": "supported",
          "decodeMsPerTokenP95": "supported",
          "decodeMsPerTokenP99": "supported",
          "js_heap_memory_metrics": "supported",
          "gpu_memory_metrics": "supported"
        }
      },
      "profile": {
        "features": {
          "kernel_level_gpu_timing": "supported",
          "operator_level_timing": "supported",
          "top_ops_summary": "supported",
          "per_decode_step_breakdown": "supported",
          "kernel_selection_trace": "supported",
          "phase_memory_breakdown": "supported",
          "cache_events": "supported",
          "replayable_trace_artifact": "unsupported"
        }
      },
      "evidence": [
        "benchmarks/vendors/harnesses/doppler-webgpu-npm.json"
      ]
    },
    {
      "id": "doppler-bun",
      "name": "Doppler (Bun WebGPU)",
      "bench": {
        "features": {
          "browser_webgpu": "unsupported",
          "node_webgpu": "unsupported",
          "bun_webgpu": "supported",
          "deno_webgpu": "unsupported",
          "headless_browser_harness": "unsupported",
          "standardized_workloads": "supported",
          "cache_mode_control": "unsupported",